{
  "format": 2,
  "name": "routersetup",
  "description": "Dedicated Router Setup Diagram",
  "blocks": [
    {
      "type": "heading",
      "text": "Dedicated Router Setup Diagram"
    },
    {
      "type": "images",
      "urls": [
        "https://vrdiscord.com/images/routersetup.png"
      ]
    }
  ]
}
