{
  "format": 2,
  "name": "oculuslink",
  "description": "Quest - Link",
  "blocks": [
    {
      "type": "heading",
      "text": "Meta Quest Link"
    },
    {
      "type": "text",
      "text": "Meta Quest Link is a feature built into the Quest that allows you to use your Quest as a PC VR headset while wired into a VR-ready PC.\nVirtual Desktop and Steam Link also support wired USB connections in their current betas as alternatives. Steam Link's initial USB support is for Meta Quest and currently requires the Steam Link, SteamVR, and Steam Client betas — see /pcvrlink."
    },
    {
      "type": "field",
      "name": "Can I play any VR game?",
      "value": "You can generally play any Meta PC or SteamVR title while on Link, as long as your PC is capable of running it."
    },
    {
      "type": "field",
      "name": "What's required?",
      "value": "You need a VR-ready PC that meets the minimum specs (you can find out more details [here](https://www.meta.com/help/quest/140991407990979/)), as well as a USB 3.0 A-to-C or C-to-C cable.\nYou can find more info about this with /linkcables."
    }
  ]
}
