{
  "format": 2,
  "name": "crossbuy",
  "description": "Quest - Cross-Buy",
  "blocks": [
    {
      "type": "heading",
      "text": "Quest/Rift Cross-Buy Apps"
    },
    {
      "type": "text",
      "text": "Rift and Quest have some games that support cross-buy, and you can find that list [here](https://www.meta.com/experiences/section/2335732183153590/).\n Please note that cross-buy can only apply between Meta PC and Quest stores, and this does not include any other platform."
    }
  ]
}
