{
  "format": 2,
  "name": "hla",
  "description": "Half-Life: Alyx - Stutter Fix",
  "blocks": [
    {
      "type": "heading",
      "text": "Half-Life: Alyx - Stutter Fix"
    },
    {
      "type": "text",
      "text": "Right-click Half-Life: Alyx in Steam then click Properties, in 'General' click 'Launch Options', and paste the following: ```+vr_fidelity_level_auto 0 +vr_fidelity_level 3```"
    }
  ]
}
