{
  "format": 2,
  "name": "virtualdesktop",
  "description": "Quest - Virtual Desktop",
  "blocks": [
    {
      "type": "heading",
      "text": "Virtual Desktop"
    },
    {
      "type": "text",
      "text": "Virtual Desktop is a Quest application that lets you use your desktop in VR, watch videos, and play PC VR games with a VR-ready PC — wirelessly, or wired over USB (new in the current beta).\nFor first-time setup and general FAQ, please check out [this guide](https://reddit.com/r/OculusQuest/wiki/faq/virtualdesktop), if you need further help, please visit their [Discord](https://discord.gg/fzvaHfpneH)"
    }
  ]
}
