{
  "format": 2,
  "name": "justask",
  "description": "Don't ask to ask",
  "blocks": [
    {
      "type": "heading",
      "text": "Don't ask to ask; just ask"
    },
    {
      "type": "text",
      "text": "When you ask 'Hey can anyone help me?', this can be seen as bad form.\nThe best way to get assistance is to ask your entire question, with details, in a relevant channel.\nThere are plenty of reasons why people who do have the knowledge would not admit to it, but by asking the full question you are asking people to answer a question, not take responsibility to answer the question they may not have the answer to."
    },
    {
      "type": "small",
      "text": "Check out <#1314732957096742952> for volunteer support."
    }
  ]
}
