{
  "format": 2,
  "name": "valvesupport",
  "description": "Index - Official Support",
  "blocks": [
    {
      "type": "heading",
      "text": "Valve Support"
    },
    {
      "type": "text",
      "text": "You can contact Valve via a ticket [here](https://help.steampowered.com/en/wizard/HelpWithGame/?appid=250820)."
    }
  ]
}
