{
  "format": 2,
  "name": "questusb",
  "description": "Quest - Link - USB",
  "blocks": [
    {
      "type": "heading",
      "text": "Quest USB/Link"
    },
    {
      "type": "text",
      "text": "Connecting your Quest VR headset with your VR ready PC using a USB cable allows you to play VR games from your PC; this includes Meta PC games and Steam games. This applies to Meta Quest Link, and now also to Virtual Desktop, which added wired USB support in its current beta. However, when purchasing a cable there are a few things to take into account: \n\n**USB Connection types**\nUSB cables can come with multiple different connector types, the ones you want to be looking for are USB type A and USB type C. All current Quest devices use a USB C port, which means that your cable needs to have at least *one* USB C connector, the other end can be either A or C; other than their shape and respective port they offer no real difference in this use case and they will perform the same.\n\n**USB standards**\nUSB standards (data speed, put simply) are important for link cables, any link cable used for any of the Quest devices should be USB 3.0 (also known as USB 3.1 Gen 1 or USB 3.2 Gen 1x1).\nNote that USB 2.0 will provide a very poor experience so avoid using those.\nYou can find these types of cables on A and C through various retailers at various lengths, performance-wise they are all equal.\n\n**Length**\nFor an optimal experience you ideally want a cable that is 3-5m long; generally it is not recommended that USB 2.0/3.0 cables are longer than that.\n\n**Battery time with a USB cable**\nPlaytime will be increased using a cable, but it is not guaranteed that the cable provides infinite playtime. This is a limitation of many motherboards and the cable plays no role.\n\nFor cable recommendations with detailed descriptions, use /linkcables."
    },
    {
      "type": "images",
      "urls": [
        "https://cdn.discordapp.com/attachments/751932324186423506/762336282437222420/unknown.png"
      ]
    }
  ]
}
