{
  "format": 2,
  "name": "iobt",
  "description": "Meta Inside Out Body Tracking",
  "blocks": [
    {
      "type": "heading",
      "text": "Inside Out Body Tracking"
    },
    {
      "type": "text",
      "text": "Meta's Inside Out Body Tracking IOBT for the Quest 2 and 3 is a technology that tracks the user's upper body movements using the headset's cameras. This feature allows the VR system to accurately display the user's arms and torso movements in VR. \n\nMeta has an inside out body tracking demo you can try [here](https://www.meta.com/experiences/6511679575602893/). This is also used on Virtual Desktop for Full Body Tracking on SteamVR."
    }
  ]
}
