{
  "format": 2,
  "name": "altroutersetup",
  "description": "Alternate Dedicated Router Setup Diagrams",
  "blocks": [
    {
      "type": "heading",
      "text": "Alternate Dedicated Router Setup Diagrams"
    },
    {
      "type": "images",
      "urls": [
        "https://vrdiscord.com/images/network_setups.png"
      ]
    }
  ]
}
