{
  "format": 2,
  "name": "crossplay",
  "description": "Quest - Crossplay",
  "blocks": [
    {
      "type": "heading",
      "text": "Quest/Rift Crossplay Apps"
    },
    {
      "type": "text",
      "text": "Rift and Quest have some games that support crossplay (playing multiplayer between different platforms (Steam, Rift, Quest, and/or PSVR)), and you can find that list [here](https://www.reddit.com/r/oculus/wiki/crossplay).\nPlease note that this is a community-maintained list and will not always be accurate. (Usually outdated)"
    }
  ]
}
